{
  "schemaVersion": "0.2.0",
  "scan_id": "demo-scan-1",
  "kind": "docs",
  "assessments": [
    {
      "feature_id": "resume-importer",
      "assessment": {
        "state": "assessed",
        "result": "linked-evidence",
        "adapter_ids": [
          "fixture-document"
        ],
        "links": [
          {
            "surface_id": "import-doc",
            "association": "explicit-annotation"
          }
        ],
        "reason": "An explicit feature annotation was found in the inspected documentation."
      }
    },
    {
      "feature_id": "admin-export",
      "assessment": {
        "state": "assessed",
        "result": "no-linked-evidence",
        "adapter_ids": [
          "fixture-document"
        ],
        "links": [],
        "reason": "The adapter completed its declared local scope without an accepted association."
      }
    },
    {
      "feature_id": "storage-helper",
      "assessment": {
        "state": "unassessed",
        "result": "unknown",
        "adapter_ids": [],
        "links": [],
        "reason": "This dimension has not been assessed."
      }
    }
  ]
}
