{
  "schemaVersion": "0.2.0",
  "scan_id": "scan-b3bf51def6f6",
  "kind": "docs",
  "assessments": [
    {
      "feature_id": "cmd-check",
      "assessment": {
        "state": "partial",
        "result": "linked-evidence",
        "adapter_ids": [
          "markdown-document"
        ],
        "links": [
          {
            "surface_id": "doc-docs-genesis",
            "association": "static-reference"
          },
          {
            "surface_id": "doc-docs-label",
            "association": "static-reference"
          },
          {
            "surface_id": "doc-docs-merge-and-check",
            "association": "static-reference"
          },
          {
            "surface_id": "doc-docs-phase-1-brief",
            "association": "static-reference"
          },
          {
            "surface_id": "doc-readme",
            "association": "static-reference"
          }
        ],
        "reason": "A document names this capability in a heading or code span. That is a sign. It does not mean the documentation is adequate."
      }
    },
    {
      "feature_id": "cmd-init",
      "assessment": {
        "state": "partial",
        "result": "linked-evidence",
        "adapter_ids": [
          "markdown-document"
        ],
        "links": [
          {
            "surface_id": "doc-docs-genesis",
            "association": "static-reference"
          },
          {
            "surface_id": "doc-docs-phase-1-brief",
            "association": "static-reference"
          },
          {
            "surface_id": "doc-readme",
            "association": "static-reference"
          }
        ],
        "reason": "A document names this capability in a heading or code span. That is a sign. It does not mean the documentation is adequate."
      }
    },
    {
      "feature_id": "cmd-refresh-config",
      "assessment": {
        "state": "unassessed",
        "result": "unknown",
        "adapter_ids": [
          "markdown-document"
        ],
        "links": [],
        "reason": "No explicit documentation association. Filename resemblance is not an accepted link."
      }
    },
    {
      "feature_id": "cmd-report",
      "assessment": {
        "state": "partial",
        "result": "linked-evidence",
        "adapter_ids": [
          "markdown-document"
        ],
        "links": [
          {
            "surface_id": "doc-docs-genesis",
            "association": "static-reference"
          },
          {
            "surface_id": "doc-docs-merge-and-check",
            "association": "static-reference"
          },
          {
            "surface_id": "doc-docs-phase-1-brief",
            "association": "static-reference"
          },
          {
            "surface_id": "doc-readme",
            "association": "static-reference"
          }
        ],
        "reason": "A document names this capability in a heading or code span. That is a sign. It does not mean the documentation is adequate."
      }
    },
    {
      "feature_id": "cmd-review",
      "assessment": {
        "state": "partial",
        "result": "linked-evidence",
        "adapter_ids": [
          "markdown-document"
        ],
        "links": [
          {
            "surface_id": "doc-readme",
            "association": "static-reference"
          }
        ],
        "reason": "A document names this capability in a heading or code span. That is a sign. It does not mean the documentation is adequate."
      }
    },
    {
      "feature_id": "cmd-scan",
      "assessment": {
        "state": "partial",
        "result": "linked-evidence",
        "adapter_ids": [
          "markdown-document"
        ],
        "links": [
          {
            "surface_id": "doc-docs-genesis",
            "association": "static-reference"
          },
          {
            "surface_id": "doc-docs-phase-1-brief",
            "association": "static-reference"
          },
          {
            "surface_id": "doc-readme",
            "association": "static-reference"
          }
        ],
        "reason": "A document names this capability in a heading or code span. That is a sign. It does not mean the documentation is adequate."
      }
    },
    {
      "feature_id": "cmd-show",
      "assessment": {
        "state": "partial",
        "result": "linked-evidence",
        "adapter_ids": [
          "markdown-document"
        ],
        "links": [
          {
            "surface_id": "doc-docs-phase-1-brief",
            "association": "static-reference"
          },
          {
            "surface_id": "doc-readme",
            "association": "static-reference"
          }
        ],
        "reason": "A document names this capability in a heading or code span. That is a sign. It does not mean the documentation is adequate."
      }
    }
  ]
}
